[
  {
    "id": "Fe-notable-001",
    "name": "Thermite reaction",
    "equation": "2 Al(s) + Fe2O3(s) -> Al2O3(s) + 2 Fe(l)",
    "equation_latex": "2\\,\\text{Al}(s) + \\text{Fe}_2\\text{O}_3(s) \\rightarrow \\text{Al}_2\\text{O}_3(s) + 2\\,\\text{Fe}(l)",
    "type": "aluminothermic",
    "category": "notable",
    "elements_involved": [
      "Al",
      "Fe",
      "O"
    ],
    "reactants": [
      {
        "formula": "Al",
        "moles": 2,
        "state": "s"
      },
      {
        "formula": "Fe2O3",
        "moles": 1,
        "state": "s"
      }
    ],
    "products": [
      {
        "formula": "Al2O3",
        "moles": 1,
        "state": "s"
      },
      {
        "formula": "Fe",
        "moles": 2,
        "state": "l"
      }
    ],
    "thermodynamics": {
      "delta_h_kj": -851.5,
      "delta_g_kj": -818.4,
      "delta_s_j_k": -111,
      "exothermic": true
    },
    "conditions": {
      "temperature_k": null,
      "pressure_atm": null,
      "catalyst": null,
      "other": "ignited with Mg ribbon; reaches ~2500C; used for rail welding"
    },
    "reversible": false,
    "description": "Extremely exothermic aluminothermic reaction. Produces molten iron at >2500C. Used to weld railroad rails."
  },
  {
    "id": "Na-notable-001",
    "name": "Sodium in water",
    "equation": "2 Na(s) + 2 H2O(l) -> 2 NaOH(aq) + H2(g)",
    "equation_latex": "2\\,\\text{Na}(s) + 2\\,\\text{H}_2\\text{O}(l) \\rightarrow 2\\,\\text{NaOH}(aq) + \\text{H}_2(g)",
    "type": "single displacement",
    "category": "notable",
    "elements_involved": [
      "Na",
      "H",
      "O"
    ],
    "reactants": [
      {
        "formula": "Na",
        "moles": 2,
        "state": "s"
      },
      {
        "formula": "H2O",
        "moles": 2,
        "state": "l"
      }
    ],
    "products": [
      {
        "formula": "NaOH",
        "moles": 2,
        "state": "aq"
      },
      {
        "formula": "H2",
        "moles": 1,
        "state": "g"
      }
    ],
    "thermodynamics": {
      "delta_h_kj": -368,
      "delta_g_kj": null,
      "delta_s_j_k": null,
      "exothermic": true
    },
    "conditions": {
      "temperature_k": null,
      "pressure_atm": null,
      "catalyst": null,
      "other": "violent; Na melts and skates on water surface; H2 may ignite with yellow flame"
    },
    "reversible": false,
    "description": "Alkali metal reacts violently with water. Na melts into a ball, dashes across surface. H2 may ignite."
  },
  {
    "id": "K-notable-001",
    "name": "Potassium in water",
    "equation": "2 K(s) + 2 H2O(l) -> 2 KOH(aq) + H2(g)",
    "equation_latex": "2\\,\\text{K}(s) + 2\\,\\text{H}_2\\text{O}(l) \\rightarrow 2\\,\\text{KOH}(aq) + \\text{H}_2(g)",
    "type": "single displacement",
    "category": "notable",
    "elements_involved": [
      "K",
      "H",
      "O"
    ],
    "reactants": [
      {
        "formula": "K",
        "moles": 2,
        "state": "s"
      },
      {
        "formula": "H2O",
        "moles": 2,
        "state": "l"
      }
    ],
    "products": [
      {
        "formula": "KOH",
        "moles": 2,
        "state": "aq"
      },
      {
        "formula": "H2",
        "moles": 1,
        "state": "g"
      }
    ],
    "thermodynamics": {
      "delta_h_kj": -392,
      "delta_g_kj": null,
      "delta_s_j_k": null,
      "exothermic": true
    },
    "conditions": {
      "temperature_k": null,
      "pressure_atm": null,
      "catalyst": null,
      "other": "more violent than Na; lilac flame from K vapor; may explode"
    },
    "reversible": false,
    "description": "Even more violent than sodium. H2 always ignites with lilac flame. Can explode."
  },
  {
    "id": "Li-notable-001",
    "name": "Lithium in water",
    "equation": "2 Li(s) + 2 H2O(l) -> 2 LiOH(aq) + H2(g)",
    "equation_latex": "2\\,\\text{Li}(s) + 2\\,\\text{H}_2\\text{O}(l) \\rightarrow 2\\,\\text{LiOH}(aq) + \\text{H}_2(g)",
    "type": "single displacement",
    "category": "notable",
    "elements_involved": [
      "Li",
      "H",
      "O"
    ],
    "reactants": [
      {
        "formula": "Li",
        "moles": 2,
        "state": "s"
      },
      {
        "formula": "H2O",
        "moles": 2,
        "state": "l"
      }
    ],
    "products": [
      {
        "formula": "LiOH",
        "moles": 2,
        "state": "aq"
      },
      {
        "formula": "H2",
        "moles": 1,
        "state": "g"
      }
    ],
    "thermodynamics": {
      "delta_h_kj": -446,
      "delta_g_kj": null,
      "delta_s_j_k": null,
      "exothermic": true
    },
    "conditions": {
      "temperature_k": null,
      "pressure_atm": null,
      "catalyst": null,
      "other": "gentle fizzing; lithium floats and slowly dissolves; crimson specks"
    },
    "reversible": false,
    "description": "Least violent alkali metal + water. Gentle fizzing. Li has highest ionization energy of group 1."
  },
  {
    "id": "Rb-notable-001",
    "name": "Rubidium in water",
    "equation": "2 Rb(s) + 2 H2O(l) -> 2 RbOH(aq) + H2(g)",
    "equation_latex": "2\\,\\text{Rb}(s) + 2\\,\\text{H}_2\\text{O}(l) \\rightarrow 2\\,\\text{RbOH}(aq) + \\text{H}_2(g)",
    "type": "single displacement",
    "category": "notable",
    "elements_involved": [
      "Rb",
      "H",
      "O"
    ],
    "reactants": [
      {
        "formula": "Rb",
        "moles": 2,
        "state": "s"
      },
      {
        "formula": "H2O",
        "moles": 2,
        "state": "l"
      }
    ],
    "products": [
      {
        "formula": "RbOH",
        "moles": 2,
        "state": "aq"
      },
      {
        "formula": "H2",
        "moles": 1,
        "state": "g"
      }
    ],
    "thermodynamics": {
      "delta_h_kj": null,
      "delta_g_kj": null,
      "delta_s_j_k": null,
      "exothermic": true
    },
    "conditions": {
      "temperature_k": null,
      "pressure_atm": null,
      "catalyst": null,
      "other": "extremely violent; spontaneous ignition of H2; handled only in inert atmosphere"
    },
    "reversible": false,
    "description": "Extremely violent reaction. Ignites immediately on contact with water. Must handle under argon."
  },
  {
    "id": "Cs-notable-001",
    "name": "Caesium in water",
    "equation": "2 Cs(s) + 2 H2O(l) -> 2 CsOH(aq) + H2(g)",
    "equation_latex": "2\\,\\text{Cs}(s) + 2\\,\\text{H}_2\\text{O}(l) \\rightarrow 2\\,\\text{CsOH}(aq) + \\text{H}_2(g)",
    "type": "single displacement",
    "category": "notable",
    "elements_involved": [
      "Cs",
      "H",
      "O"
    ],
    "reactants": [
      {
        "formula": "Cs",
        "moles": 2,
        "state": "s"
      },
      {
        "formula": "H2O",
        "moles": 2,
        "state": "l"
      }
    ],
    "products": [
      {
        "formula": "CsOH",
        "moles": 2,
        "state": "aq"
      },
      {
        "formula": "H2",
        "moles": 1,
        "state": "g"
      }
    ],
    "thermodynamics": {
      "delta_h_kj": null,
      "delta_g_kj": null,
      "delta_s_j_k": null,
      "exothermic": true
    },
    "conditions": {
      "temperature_k": null,
      "pressure_atm": null,
      "catalyst": null,
      "other": "explosive; shatters glass container; Coulomb explosion (2015 Nature Chemistry)"
    },
    "reversible": false,
    "description": "Most violent alkali metal + water. Explodes instantly. 2015 study showed Coulomb explosion mechanism."
  },
  {
    "id": "Xe-notable-001",
    "name": "Xenon hexafluoroplatinate (first noble gas compound)",
    "equation": "Xe(g) + PtF6(g) -> [XePtF6](s)",
    "equation_latex": "\\text{Xe}(g) + \\text{PtF}_6(g) \\rightarrow [\\text{XePtF}_6](s)",
    "type": "synthesis",
    "category": "notable",
    "elements_involved": [
      "Xe",
      "Pt",
      "F"
    ],
    "reactants": [
      {
        "formula": "Xe",
        "moles": 1,
        "state": "g"
      },
      {
        "formula": "PtF6",
        "moles": 1,
        "state": "g"
      }
    ],
    "products": [
      {
        "formula": "XePtF6",
        "moles": 1,
        "state": "s"
      }
    ],
    "thermodynamics": {
      "delta_h_kj": null,
      "delta_g_kj": null,
      "delta_s_j_k": null,
      "exothermic": true
    },
    "conditions": {
      "temperature_k": null,
      "pressure_atm": null,
      "catalyst": null,
      "other": "Neil Bartlett, 1962; orange-yellow solid"
    },
    "reversible": false,
    "description": "First noble gas compound. Neil Bartlett (1962) shattered the 'noble gases are inert' dogma."
  },
  {
    "id": "Xe-notable-002",
    "name": "Xenon difluoride synthesis",
    "equation": "Xe(g) + F2(g) -> XeF2(s)",
    "equation_latex": "\\text{Xe}(g) + \\text{F}_2(g) \\rightarrow \\text{XeF}_2(s)",
    "type": "synthesis",
    "category": "notable",
    "elements_involved": [
      "Xe",
      "F"
    ],
    "reactants": [
      {
        "formula": "Xe",
        "moles": 1,
        "state": "g"
      },
      {
        "formula": "F2",
        "moles": 1,
        "state": "g"
      }
    ],
    "products": [
      {
        "formula": "XeF2",
        "moles": 1,
        "state": "s"
      }
    ],
    "thermodynamics": {
      "delta_h_kj": -108,
      "delta_g_kj": null,
      "delta_s_j_k": null,
      "exothermic": true
    },
    "conditions": {
      "temperature_k": null,
      "pressure_atm": null,
      "catalyst": null,
      "other": "UV irradiation or high pressure; colorless crystals; used in semiconductor etching"
    },
    "reversible": false,
    "description": "Simplest noble gas compound made synthetically. Linear molecule. Used in semiconductor fabrication."
  },
  {
    "id": "U-notable-001",
    "name": "Uranium-235 nuclear fission",
    "equation": "U-235 + n -> Ba-141 + Kr-92 + 3 n",
    "equation_latex": "{}^{235}\\text{U} + n \\rightarrow {}^{141}\\text{Ba} + {}^{92}\\text{Kr} + 3\\,n",
    "type": "nuclear fission",
    "category": "notable",
    "elements_involved": [